23mca4@192.168.20.100's password: 
Welcome to Ubuntu 20.04.6 LTS (GNU/Linux 5.15.0-84-generic x86_64)

 * Documentation:  https://help.ubuntu.com
 * Management:     https://landscape.canonical.com
 * Support:        https://ubuntu.com/advantage

Expanded Security Maintenance for Applications is not enabled.

222 updates can be applied immediately.
170 of these updates are standard security updates.
To see these additional updates run: apt list --upgradable

15 additional security updates can be applied with ESM Apps.
Learn more about enabling ESM Apps service at https://ubuntu.com/esm

Failed to connect to https://changelogs.ubuntu.com/meta-release-lts. Check your Internet connection or proxy settings

Your Hardware Enablement Stack (HWE) is supported until April 2025.
Last login: Mon Feb 12 13:14:31 2024 from 192.168.20.161
23mca4@rgit:~$ tree
.
├── Numcheck.class
├── NumCheck.class
├── OOP-JAVA
│   ├── AreaPerimeter.class
│   ├── AreaPerimeter.java
│   ├── CharOccur.class
│   ├── CharOccur.java
│   ├── Factorial.class
│   ├── Factorial.java
│   ├── HelloWorld.class
│   ├── HelloWorld.java
│   ├── NumCheck.class
│   ├── NumCheck.java
│   ├── Pattern.class
│   ├── Pattern.java
│   ├── SumofDig.class
│   ├── SumofDig.java
│   ├── SumofnNum.class
│   └── SumofnNum.java
└── SEM1
    ├── a.out
    ├── circularlinkedlist.c
    ├── circularlinkedlist.c.save
    ├── DisjointSet.c
    ├── doublylinkedlist.c
    ├── doublylinkedlist.c.save
    ├── labCycle1
    │   ├── arithmaticop.py
    │   ├── circlearea.py
    │   ├── dtype.py
    │   ├── greetings.py
    │   ├── salary.py
    │   ├── stringcopy.py
    │   └── volofsphere.py
    ├── labCycle2
    │   ├── $.py
    │   ├── add_ing_ly.py
    │   ├── biggest.py
    │   ├── char_frequence.py
    │   ├── colorlist2.py
    │   ├── colorlist.py
    │   ├── countinga.py
    │   ├── leng_0f_long_word.py
    │   ├── list1.py
    │   ├── listComprehensions.py
    │   ├── listComprehensions.py.save
    │   ├── list_odd.py
    │   ├── mergedictionary.py
    │   ├── pattern1.py
    │   ├── pos1swap.py
    │   ├── sortdictionary.py
    │   ├── split.py
    │   ├── storelist.py
    │   └── stringswap.py
    ├── labCycle3
    │   ├── amstrong.py
    │   ├── evnPerfectsqr.py
    │   ├── factor.py
    │   ├── fact.py
    │   ├── Fibonacci.py
    │   ├── labCycle4
    │   ├── multiplicationtable.py
    │   ├── pyramid.py
    │   ├── reverse.py
    │   ├── starpattern.py
    │   └── sumofItem.py
    ├── labCycle4
    │   ├── compare.py
    │   ├── exp5.py
    │   ├── fibonacci.py
    │   ├── lambda.py
    │   ├── oddEven.py
    │   ├── powers_of_2.py
    │   ├── series.py
    │   └── simpleInterest.py
    ├── labCycle5
    │   ├── amstrong.py
    │   ├── DateTime.py
    │   ├── Day.py
    │   └── leapyear.py
    ├── linkedlist1.c
    ├── linkedlist1.c.save
    ├── mergedarray.c
    ├── mergedarray.c.save
    ├── setDs.c
    ├── SetDs.c.save
    ├── stack.c
    └── stack.c.save

8 directories, 80 files
23mca4@rgit:~$ mysql -u 23mca4 -p
Enter password: 
Welcome to the MySQL monitor.  Commands end with ; or \g.
Your MySQL connection id is 11
Server version: 8.0.34-0ubuntu0.20.04.1 (Ubuntu)

Copyright (c) 2000, 2023, Oracle and/or its affiliates.

Oracle is a registered trademark of Oracle Corporation and/or its
affiliates. Other names may be trademarks of their respective
owners.

Type 'help;' or '\h' for help. Type '\c' to clear the current input statement.

mysql> show databases;
+--------------------+
| Database           |
+--------------------+
| 23mca4             |
| information_schema |
| performance_schema |
+--------------------+
3 rows in set (0.01 sec)

mysql> use 23mca4
Database changed
mysql> show tables;
Empty set (0.01 sec)

mysql> create table Staff(id varchar(05),DeptID int(02),Name varchar(15),Design varchar(15),Basic float(10,2),Gender varchar(1));
Query OK, 0 rows affected, 2 warnings (0.12 sec)

mysql> show tables;
+------------------+
| Tables_in_23mca4 |
+------------------+
| Staff            |
+------------------+
1 row in set (0.00 sec)

mysql> select*from Staff;
Empty set (0.00 sec)

mysql> show staff;
ERROR 1064 (42000): You have an error in your SQL syntax; check the manual that corresponds to your MySQL server version for the right syntax to use near 'staff' at line 1
mysql> desc Staff;
+--------+-------------+------+-----+---------+-------+
| Field  | Type        | Null | Key | Default | Extra |
+--------+-------------+------+-----+---------+-------+
| id     | varchar(5)  | YES  |     | NULL    |       |
| DeptID | int         | YES  |     | NULL    |       |
| Name   | varchar(15) | YES  |     | NULL    |       |
| Design | varchar(15) | YES  |     | NULL    |       |
| Basic  | float(10,2) | YES  |     | NULL    |       |
| Gender | varchar(1)  | YES  |     | NULL    |       |
+--------+-------------+------+-----+---------+-------+
6 rows in set (0.00 sec)

mysql> DROP Staff;
ERROR 1064 (42000): You have an error in your SQL syntax; check the manual that corresponds to your MySQL server version for the right syntax to use near 'Staff' at line 1
mysql> DROP table  Staff;
Query OK, 0 rows affected (0.05 sec)

mysql> show tables;
Empty set (0.00 sec)

mysql> create table Staff(id char(05),DeptID int(02),Name char(15),Design char(15),Basic float(10,2),Gender char(1));
Query OK, 0 rows affected, 2 warnings (0.06 sec)

mysql> dec Staff
    -> ;
ERROR 1064 (42000): You have an error in your SQL syntax; check the manual that corresponds to your MySQL server version for the right syntax to use near 'dec Staff' at line 1
mysql> dec Staff;
ERROR 1064 (42000): You have an error in your SQL syntax; check the manual that corresponds to your MySQL server version for the right syntax to use near 'dec Staff' at line 1
mysql> desc Staff;
+--------+-------------+------+-----+---------+-------+
| Field  | Type        | Null | Key | Default | Extra |
+--------+-------------+------+-----+---------+-------+
| id     | char(5)     | YES  |     | NULL    |       |
| DeptID | int         | YES  |     | NULL    |       |
| Name   | char(15)    | YES  |     | NULL    |       |
| Design | char(15)    | YES  |     | NULL    |       |
| Basic  | float(10,2) | YES  |     | NULL    |       |
| Gender | char(1)     | YES  |     | NULL    |       |
+--------+-------------+------+-----+---------+-------+
6 rows in set (0.00 sec)

mysql> insert into Staff("101","1""Ram","Typist","2000","M");
ERROR 1064 (42000): You have an error in your SQL syntax; check the manual that corresponds to your MySQL server version for the right syntax to use near '"101","1""Ram","Typist","2000","M")' at line 1
mysql> insert into Staff value ("101","1""Ram","Typist","2000","M");
ERROR 1136 (21S01): Column count doesn't match value count at row 1
mysql> insert into Staff value("101","1""Ram","Typist","2000","M");
ERROR 1136 (21S01): Column count doesn't match value count at row 1
mysql> insert into Staff values("101","1""Ram","Typist","2000","M");
ERROR 1136 (21S01): Column count doesn't match value count at row 1
mysql> insert into Staff values("101","1","Ram","Typist","2000","M");
Query OK, 1 row affected (0.00 sec)

mysql> Select*from Staff;
+------+--------+------+--------+---------+--------+
| id   | DeptID | Name | Design | Basic   | Gender |
+------+--------+------+--------+---------+--------+
| 101  |      1 | Ram  | Typist | 2000.00 | M      |
+------+--------+------+--------+---------+--------+
1 row in set (0.00 sec)

mysql> insert into Staff values("101","1","Ram","Typist","2000","M");
Query OK, 1 row affected (0.01 sec)

mysql> Select*from Staff;
+------+--------+------+--------+---------+--------+
| id   | DeptID | Name | Design | Basic   | Gender |
+------+--------+------+--------+---------+--------+
| 101  |      1 | Ram  | Typist | 2000.00 | M      |
| 101  |      1 | Ram  | Typist | 2000.00 | M      |
+------+--------+------+--------+---------+--------+
2 rows in set (0.00 sec)

mysql> delete from Staff where DeptID=1;
Query OK, 2 rows affected (0.00 sec)

mysql> Select*from Staff;
Empty set (0.00 sec)

mysql> insert into Staff values("101","1","Ram","Typist","2000","M");
Query OK, 1 row affected (0.03 sec)

mysql> insert into Staff values("101","1","Ram","Typist","2000","M");
Query OK, 1 row affected (0.00 sec)

mysql> insert into Staff values("102","2","Varun","Analyst","6000","M");
Query OK, 1 row affected (0.00 sec)

mysql> Select*from Staff;
+------+--------+-------+---------+---------+--------+
| id   | DeptID | Name  | Design  | Basic   | Gender |
+------+--------+-------+---------+---------+--------+
| 101  |      1 | Ram   | Typist  | 2000.00 | M      |
| 101  |      1 | Ram   | Typist  | 2000.00 | M      |
| 102  |      2 | Varun | Analyst | 6000.00 | M      |
+------+--------+-------+---------+---------+--------+
3 rows in set (0.00 sec)

mysql> delete from Staff where DeptID=1;
Query OK, 2 rows affected (0.00 sec)

mysql> insert into Staff values("101","1","Ram","Typist","2000","M");
Query OK, 1 row affected (0.00 sec)

mysql> Select*from Staff;
+------+--------+-------+---------+---------+--------+
| id   | DeptID | Name  | Design  | Basic   | Gender |
+------+--------+-------+---------+---------+--------+
| 102  |      2 | Varun | Analyst | 6000.00 | M      |
| 101  |      1 | Ram   | Typist  | 2000.00 | M      |
+------+--------+-------+---------+---------+--------+
2 rows in set (0.00 sec)

mysql> insert into Staff values("121","1","Ruby","Typist","2000","F");
Query OK, 1 row affected (0.01 sec)

mysql> insert into Staff values("156","3","Mary","Manager","4500","F","123",);
ERROR 1064 (42000): You have an error in your SQL syntax; check the manual that corresponds to your MySQL server version for the right syntax to use near ')' at line 1
mysql> Select*from Staff;
+------+--------+-------+---------+---------+--------+
| id   | DeptID | Name  | Design  | Basic   | Gender |
+------+--------+-------+---------+---------+--------+
| 102  |      2 | Varun | Analyst | 6000.00 | M      |
| 101  |      1 | Ram   | Typist  | 2000.00 | M      |
| 121  |      1 | Ruby  | Typist  | 2000.00 | F      |
+------+--------+-------+---------+---------+--------+
3 rows in set (0.00 sec)

mysql> insert into Staff values("156","3","Mary","Manager","4500","F","156","3","Mary","Manager","4500","F");
ERROR 1136 (21S01): Column count doesn't match value count at row 1
mysql> insert into Staff values("156","3","Mary","Manager","4500","F");
Query OK, 1 row affected (0.01 sec)

mysql> select*from Staff;
+------+--------+-------+---------+---------+--------+
| id   | DeptID | Name  | Design  | Basic   | Gender |
+------+--------+-------+---------+---------+--------+
| 102  |      2 | Varun | Analyst | 6000.00 | M      |
| 101  |      1 | Ram   | Typist  | 2000.00 | M      |
| 121  |      1 | Ruby  | Typist  | 2000.00 | F      |
| 156  |      3 | Mary  | Manager | 4500.00 | F      |
+------+--------+-------+---------+---------+--------+
4 rows in set (0.00 sec)

mysql> insert into Staff values("123","2","Mridula","Analyst","6000","F");
Query OK, 1 row affected (0.00 sec)

mysql> insert into Staff values("114","4","Menon","Clerk","1500","M");
Query OK, 1 row affected (0.00 sec)

mysql> insert into Staff values("115","4","Tim","Kiran","1500","M");
Query OK, 1 row affected (0.03 sec)

mysql> insert into Staff values("127","2","Kiran","manager","1500","M");
Query OK, 1 row affected (0.00 sec)

mysql> select*from Staff;
+------+--------+---------+---------+---------+--------+
| id   | DeptID | Name    | Design  | Basic   | Gender |
+------+--------+---------+---------+---------+--------+
| 102  |      2 | Varun   | Analyst | 6000.00 | M      |
| 101  |      1 | Ram     | Typist  | 2000.00 | M      |
| 121  |      1 | Ruby    | Typist  | 2000.00 | F      |
| 156  |      3 | Mary    | Manager | 4500.00 | F      |
| 123  |      2 | Mridula | Analyst | 6000.00 | F      |
| 114  |      4 | Menon   | Clerk   | 1500.00 | M      |
| 115  |      4 | Tim     | Kiran   | 1500.00 | M      |
| 127  |      2 | Kiran   | manager | 1500.00 | M      |
+------+--------+---------+---------+---------+--------+
8 rows in set (0.00 sec)

mysql> Update Staff set Design=Clerk where Name=Tim;
ERROR 1054 (42S22): Unknown column 'Tim' in 'where clause'
mysql> Update Staff set Design="Clerk" where Name="Tim";
Query OK, 1 row affected (0.00 sec)
Rows matched: 1  Changed: 1  Warnings: 0

mysql> select*from Staff;
+------+--------+---------+---------+---------+--------+
| id   | DeptID | Name    | Design  | Basic   | Gender |
+------+--------+---------+---------+---------+--------+
| 102  |      2 | Varun   | Analyst | 6000.00 | M      |
| 101  |      1 | Ram     | Typist  | 2000.00 | M      |
| 121  |      1 | Ruby    | Typist  | 2000.00 | F      |
| 156  |      3 | Mary    | Manager | 4500.00 | F      |
| 123  |      2 | Mridula | Analyst | 6000.00 | F      |
| 114  |      4 | Menon   | Clerk   | 1500.00 | M      |
| 115  |      4 | Tim     | Clerk   | 1500.00 | M      |
| 127  |      2 | Kiran   | manager | 1500.00 | M      |
+------+--------+---------+---------+---------+--------+
8 rows in set (0.00 sec)

mysql> Update Staff set Basic="4000" where Name="Tim";
Query OK, 1 row affected (0.00 sec)
Rows matched: 1  Changed: 1  Warnings: 0

mysql> select*from Staff;
+------+--------+---------+---------+---------+--------+
| id   | DeptID | Name    | Design  | Basic   | Gender |
+------+--------+---------+---------+---------+--------+
| 102  |      2 | Varun   | Analyst | 6000.00 | M      |
| 101  |      1 | Ram     | Typist  | 2000.00 | M      |
| 121  |      1 | Ruby    | Typist  | 2000.00 | F      |
| 156  |      3 | Mary    | Manager | 4500.00 | F      |
| 123  |      2 | Mridula | Analyst | 6000.00 | F      |
| 114  |      4 | Menon   | Clerk   | 1500.00 | M      |
| 115  |      4 | Tim     | Clerk   | 4000.00 | M      |
| 127  |      2 | Kiran   | manager | 1500.00 | M      |
+------+--------+---------+---------+---------+--------+
8 rows in set (0.00 sec)

mysql> Update Staff set Basic="1500" where Name="Tim";
Query OK, 1 row affected (0.00 sec)
Rows matched: 1  Changed: 1  Warnings: 0

mysql> Update Staff set Basic="4000" where Name="Kiran";
Query OK, 1 row affected (0.00 sec)
Rows matched: 1  Changed: 1  Warnings: 0

mysql> select*from Staff;
+------+--------+---------+---------+---------+--------+
| id   | DeptID | Name    | Design  | Basic   | Gender |
+------+--------+---------+---------+---------+--------+
| 102  |      2 | Varun   | Analyst | 6000.00 | M      |
| 101  |      1 | Ram     | Typist  | 2000.00 | M      |
| 121  |      1 | Ruby    | Typist  | 2000.00 | F      |
| 156  |      3 | Mary    | Manager | 4500.00 | F      |
| 123  |      2 | Mridula | Analyst | 6000.00 | F      |
| 114  |      4 | Menon   | Clerk   | 1500.00 | M      |
| 115  |      4 | Tim     | Clerk   | 1500.00 | M      |
| 127  |      2 | Kiran   | manager | 4000.00 | M      |
+------+--------+---------+---------+---------+--------+
8 rows in set (0.00 sec)

mysql> select ID,Name,Design,basic from staff;
ERROR 1146 (42S02): Table '23mca4.staff' doesn't exist
mysql> select ID,Name,Design,basic from Staff;
+------+---------+---------+---------+
| ID   | Name    | Design  | basic   |
+------+---------+---------+---------+
| 102  | Varun   | Analyst | 6000.00 |
| 101  | Ram     | Typist  | 2000.00 |
| 121  | Ruby    | Typist  | 2000.00 |
| 156  | Mary    | Manager | 4500.00 |
| 123  | Mridula | Analyst | 6000.00 |
| 114  | Menon   | Clerk   | 1500.00 |
| 115  | Tim     | Clerk   | 1500.00 |
| 127  | Kiran   | manager | 4000.00 |
+------+---------+---------+---------+
8 rows in set (0.00 sec)

mysql> select ID,Name, from Staff where dept id=2;
ERROR 1064 (42000): You have an error in your SQL syntax; check the manual that corresponds to your MySQL server version for the right syntax to use near 'from Staff where dept id=2' at line 1
mysql> select ID,Name from Staff where dept id=2;
ERROR 1064 (42000): You have an error in your SQL syntax; check the manual that corresponds to your MySQL server version for the right syntax to use near 'id=2' at line 1
mysql> select ID,Name from Staff where DeptID=2;
+------+---------+
| ID   | Name    |
+------+---------+
| 102  | Varun   |
| 123  | Mridula |
| 127  | Kiran   |
+------+---------+
3 rows in set (0.00 sec)

mysql> select ID,Name,Design AS Designation,DeptID,Basic from Staff WHERE Design="Typist";
+------+------+-------------+--------+---------+
| ID   | Name | Designation | DeptID | Basic   |
+------+------+-------------+--------+---------+
| 101  | Ram  | Typist      |      1 | 2000.00 |
| 121  | Ruby | Typist      |      1 | 2000.00 |
+------+------+-------------+--------+---------+
2 rows in set (0.00 sec)

mysql> SELECTt*FROM Staff WHERE Design IN("Analyst,Manager);
    "> SELECT*FROM Staff WHERE Design IN("Analyst,Manager);
ERROR 1064 (42000): You have an error in your SQL syntax; check the manual that corresponds to your MySQL server version for the right syntax to use near 'SELECTt*FROM Staff WHERE Design IN("Analyst,Manager);
SELECT*FROM Staff WHERE De' at line 1
mysql> SELECTt*FROM Staff WHERE Design IN("Analyst,Manager);
SELECT*FROM Staff WHERE Design IN("Analyst,Manager);
ERROR 1064 (42000): You have an error in your SQL syntax; check the manual that corresponds to your MySQL server version for the right syntax to use near 'SELECTt*FROM Staff WHERE Design IN("Analyst,Manager);
SELECT*FROM Staff WHERE De' at line 1
mysql> SELECTt*FROM Staff WHERE Design IN("Analyst,Manager);
SELECT*FROM Staff WHERE Design IN("Analyst","Manager");
    "> 
[1]+  Stopped                 mysql -u 23mca4 -p
23mca4@rgit:~$ mysql -u 23mca4 -p
Enter password: 
Welcome to the MySQL monitor.  Commands end with ; or \g.
Your MySQL connection id is 49
Server version: 8.0.34-0ubuntu0.20.04.1 (Ubuntu)

Copyright (c) 2000, 2023, Oracle and/or its affiliates.

Oracle is a registered trademark of Oracle Corporation and/or its
affiliates. Other names may be trademarks of their respective
owners.

Type 'help;' or '\h' for help. Type '\c' to clear the current input statement.

mysql> SELECT*FROM Staff WHERE Design IN(Analyst,Manager);
ERROR 1046 (3D000): No database selected
mysql> use 23mca4
Reading table information for completion of table and column names
You can turn off this feature to get a quicker startup with -A

Database changed
mysql> 
mysql> SELECT*FROM Staff WHERE Design IN(Analyst,Manager);
ERROR 1054 (42S22): Unknown column 'Analyst' in 'where clause'
mysql> SELECT*FROM Staff WHERE Design IN("Analyst","Manager");
+------+--------+---------+---------+---------+--------+
| id   | DeptID | Name    | Design  | Basic   | Gender |
+------+--------+---------+---------+---------+--------+
| 102  |      2 | Varun   | Analyst | 6000.00 | M      |
| 156  |      3 | Mary    | Manager | 4500.00 | F      |
| 123  |      2 | Mridula | Analyst | 6000.00 | F      |
| 127  |      2 | Kiran   | manager | 4000.00 | M      |
+------+--------+---------+---------+---------+--------+
4 rows in set (0.00 sec)

mysql> SELECT DISTINCT Design AS Designation FROM Staff;
+-------------+
| Designation |
+-------------+
| Analyst     |
| Typist      |
| Manager     |
| Clerk       |
+-------------+
4 rows in set (0.00 sec)

mysql> SELECT COUNT(*) AS Male Count FROM Staff WHERE Gender="M";
ERROR 1064 (42000): You have an error in your SQL syntax; check the manual that corresponds to your MySQL server version for the right syntax to use near 'Count FROM Staff WHERE Gender="M"' at line 1
mysql> SELECT COUNT(*) AS MaleCount FROM Staff WHERE Gender="M";
+-----------+
| MaleCount |
+-----------+
|         5 |
+-----------+
1 row in set (0.00 sec)

mysql> SELECT Design AS Designation,MAX(Basic) AS MAXSALARY FROM Staff GROUP BY Design;
+-------------+-----------+
| Designation | MAXSALARY |
+-------------+-----------+
| Analyst     |   6000.00 |
| Typist      |   2000.00 |
| Manager     |   4500.00 |
| Clerk       |   1500.00 |
+-------------+-----------+
4 rows in set (0.00 sec)

mysql> ALTER table Staff ADD "Manager id" int(5);
ERROR 1064 (42000): You have an error in your SQL syntax; check the manual that corresponds to your MySQL server version for the right syntax to use near '"Manager id" int(5)' at line 1
mysql> 
mysql> ALTER table Staff ADD Manager id int(5);
ERROR 1064 (42000): You have an error in your SQL syntax; check the manual that corresponds to your MySQL server version for the right syntax to use near 'id int(5)' at line 1
mysql> ALTER table Staff ADD Manager id int;
ERROR 1064 (42000): You have an error in your SQL syntax; check the manual that corresponds to your MySQL server version for the right syntax to use near 'id int' at line 1
mysql> ALTER table Staff ADD ManagerID char(5);

Query OK, 0 rows affected (0.05 sec)
Records: 0  Duplicates: 0  Warnings: 0

mysql> 
mysql> DESC Staff;
+-----------+-------------+------+-----+---------+-------+
| Field     | Type        | Null | Key | Default | Extra |
+-----------+-------------+------+-----+---------+-------+
| id        | char(5)     | YES  |     | NULL    |       |
| DeptID    | int         | YES  |     | NULL    |       |
| Name      | char(15)    | YES  |     | NULL    |       |
| Design    | char(15)    | YES  |     | NULL    |       |
| Basic     | float(10,2) | YES  |     | NULL    |       |
| Gender    | char(1)     | YES  |     | NULL    |       |
| ManagerID | char(5)     | YES  |     | NULL    |       |
+-----------+-------------+------+-----+---------+-------+
7 rows in set (0.00 sec)

mysql> UPDATE table Staff,SET ManagerID=NULL,WHERE ID IN(101,121,156);
ERROR 1064 (42000): You have an error in your SQL syntax; check the manual that corresponds to your MySQL server version for the right syntax to use near 'table Staff,SET ManagerID=NULL,WHERE ID IN(101,121,156)' at line 1
mysql> select*from staff;
ERROR 1146 (42S02): Table '23mca4.staff' doesn't exist
mysql> select*from Staff;
+------+--------+---------+---------+---------+--------+-----------+
| id   | DeptID | Name    | Design  | Basic   | Gender | ManagerID |
+------+--------+---------+---------+---------+--------+-----------+
| 102  |      2 | Varun   | Analyst | 6000.00 | M      | NULL      |
| 101  |      1 | Ram     | Typist  | 2000.00 | M      | NULL      |
| 121  |      1 | Ruby    | Typist  | 2000.00 | F      | NULL      |
| 156  |      3 | Mary    | Manager | 4500.00 | F      | NULL      |
| 123  |      2 | Mridula | Analyst | 6000.00 | F      | NULL      |
| 114  |      4 | Menon   | Clerk   | 1500.00 | M      | NULL      |
| 115  |      4 | Tim     | Clerk   | 1500.00 | M      | NULL      |
| 127  |      2 | Kiran   | manager | 4000.00 | M      | NULL      |
+------+--------+---------+---------+---------+--------+-----------+
8 rows in set (0.00 sec)

mysql> UPDATE table Staff,SET ManagerID=121,WHERE ID="121";
ERROR 1064 (42000): You have an error in your SQL syntax; check the manual that corresponds to your MySQL server version for the right syntax to use near 'table Staff,SET ManagerID=121,WHERE ID="121"' at line 1
mysql> UPDATE Staff,SET ManagerID=121,WHERE ID="121";
ERROR 1064 (42000): You have an error in your SQL syntax; check the manual that corresponds to your MySQL server version for the right syntax to use near 'SET ManagerID=121,WHERE ID="121"' at line 1
mysql> UPDATE Staff,SET ManagerID="121",WHERE ID="127";
ERROR 1064 (42000): You have an error in your SQL syntax; check the manual that corresponds to your MySQL server version for the right syntax to use near 'SET ManagerID="121",WHERE ID="127"' at line 1
mysql> UPDATE Staff,SET ManagerID="121",WHERE ID="127";
ERROR 1064 (42000): You have an error in your SQL syntax; check the manual that corresponds to your MySQL server version for the right syntax to use near 'SET ManagerID="121",WHERE ID="127"' at line 1
mysql> UPDATE Staff,SET ManagerID=121,WHERE ID=127;
ERROR 1064 (42000): You have an error in your SQL syntax; check the manual that corresponds to your MySQL server version for the right syntax to use near 'SET ManagerID=121,WHERE ID=127' at line 1
mysql> UPDATE Staff SET ManagerID=121 WHERE ID=127;
Query OK, 1 row affected (0.00 sec)
Rows matched: 1  Changed: 1  Warnings: 0

mysql> select*from Staff;
+------+--------+---------+---------+---------+--------+-----------+
| id   | DeptID | Name    | Design  | Basic   | Gender | ManagerID |
+------+--------+---------+---------+---------+--------+-----------+
| 102  |      2 | Varun   | Analyst | 6000.00 | M      | NULL      |
| 101  |      1 | Ram     | Typist  | 2000.00 | M      | NULL      |
| 121  |      1 | Ruby    | Typist  | 2000.00 | F      | NULL      |
| 156  |      3 | Mary    | Manager | 4500.00 | F      | NULL      |
| 123  |      2 | Mridula | Analyst | 6000.00 | F      | NULL      |
| 114  |      4 | Menon   | Clerk   | 1500.00 | M      | NULL      |
| 115  |      4 | Tim     | Clerk   | 1500.00 | M      | NULL      |
| 127  |      2 | Kiran   | manager | 4000.00 | M      | 121       |
+------+--------+---------+---------+---------+--------+-----------+
8 rows in set (0.00 sec)

mysql> UPDATE Staff,SET ManagerID=121,WHERE ID IN("114","115");
ERROR 1064 (42000): You have an error in your SQL syntax; check the manual that corresponds to your MySQL server version for the right syntax to use near 'SET ManagerID=121,WHERE ID IN("114","115")' at line 1
mysql> UPDATE Staff SET ManagerID=121 WHERE ID IN("114","115");
Query OK, 2 rows affected (0.00 sec)
Rows matched: 2  Changed: 2  Warnings: 0

mysql> select*from Staff;
+------+--------+---------+---------+---------+--------+-----------+
| id   | DeptID | Name    | Design  | Basic   | Gender | ManagerID |
+------+--------+---------+---------+---------+--------+-----------+
| 102  |      2 | Varun   | Analyst | 6000.00 | M      | NULL      |
| 101  |      1 | Ram     | Typist  | 2000.00 | M      | NULL      |
| 121  |      1 | Ruby    | Typist  | 2000.00 | F      | NULL      |
| 156  |      3 | Mary    | Manager | 4500.00 | F      | NULL      |
| 123  |      2 | Mridula | Analyst | 6000.00 | F      | NULL      |
| 114  |      4 | Menon   | Clerk   | 1500.00 | M      | 121       |
| 115  |      4 | Tim     | Clerk   | 1500.00 | M      | 121       |
| 127  |      2 | Kiran   | manager | 4000.00 | M      | 121       |
+------+--------+---------+---------+---------+--------+-----------+
8 rows in set (0.01 sec)

mysql> UPDATE Staff SET ManagerID=102 WHERE ID IN("114","115");
Query OK, 2 rows affected (0.00 sec)
Rows matched: 2  Changed: 2  Warnings: 0

mysql> UPDATE Staff SET ManagerID=NULL WHERE ID IN("101","151","156");
Query OK, 0 rows affected (0.00 sec)
Rows matched: 2  Changed: 0  Warnings: 0

mysql> select*from Staff;
+------+--------+---------+---------+---------+--------+-----------+
| id   | DeptID | Name    | Design  | Basic   | Gender | ManagerID |
+------+--------+---------+---------+---------+--------+-----------+
| 102  |      2 | Varun   | Analyst | 6000.00 | M      | NULL      |
| 101  |      1 | Ram     | Typist  | 2000.00 | M      | NULL      |
| 121  |      1 | Ruby    | Typist  | 2000.00 | F      | NULL      |
| 156  |      3 | Mary    | Manager | 4500.00 | F      | NULL      |
| 123  |      2 | Mridula | Analyst | 6000.00 | F      | NULL      |
| 114  |      4 | Menon   | Clerk   | 1500.00 | M      | 102       |
| 115  |      4 | Tim     | Clerk   | 1500.00 | M      | 102       |
| 127  |      2 | Kiran   | manager | 4000.00 | M      | 121       |
+------+--------+---------+---------+---------+--------+-----------+
8 rows in set (0.00 sec)

mysql> SELECT ManagerID from Staff WHERE Name="Ram";
+-----------+
| ManagerID |
+-----------+
| NULL      |
+-----------+
1 row in set (0.00 sec)

mysql> SELECT AVG(Basic) FROM Staff Group by DeptID;
+-------------+
| AVG(Basic)  |
+-------------+
| 5333.333333 |
| 2000.000000 |
| 4500.000000 |
| 1500.000000 |
+-------------+
4 rows in set (0.00 sec)

mysql> SELECT Distinct DeptID AVG(Basic) FROM Staff Group by DeptID;
ERROR 1064 (42000): You have an error in your SQL syntax; check the manual that corresponds to your MySQL server version for the right syntax to use near '(Basic) FROM Staff Group by DeptID' at line 1
mysql> SELECT Distinct DeptID,AVG(Basic) FROM Staff Group by DeptID;
+--------+-------------+
| DeptID | AVG(Basic)  |
+--------+-------------+
|      2 | 5333.333333 |
|      1 | 2000.000000 |
|      3 | 4500.000000 |
|      4 | 1500.000000 |
+--------+-------------+
4 rows in set (0.00 sec)

mysql> SELECT Name WHERE MAX(Basic);
ERROR 1054 (42S22): Unknown column 'Name' in 'field list'
mysql> SELECT Name,MAX(Basic);
ERROR 1054 (42S22): Unknown column 'Name' in 'field list'
mysql> SELECT MAX(Basic);
ERROR 1054 (42S22): Unknown column 'Basic' in 'field list'
mysql> SELECT Name FROM Staff WHERE  MAX(Basic);
ERROR 1111 (HY000): Invalid use of group function
mysql> SELECT Name, MAX(Basic) FROM Staff;
ERROR 1140 (42000): In aggregated query without GROUP BY, expression #1 of SELECT list contains nonaggregated column '23mca4.Staff.Name'; this is incompatible with sql_mode=only_full_group_by
mysql> SELECT Name, MAX(Basic) FROM Staff GROUP BY Name;
+---------+------------+
| Name    | MAX(Basic) |
+---------+------------+
| Varun   |    6000.00 |
| Ram     |    2000.00 |
| Ruby    |    2000.00 |
| Mary    |    4500.00 |
| Mridula |    6000.00 |
| Menon   |    1500.00 |
| Tim     |    1500.00 |
| Kiran   |    4000.00 |
+---------+------------+
8 rows in set (0.00 sec)

mysql> SELECT MAX(Basic)AS MAXSALARY FROM Staff;
+-----------+
| MAXSALARY |
+-----------+
|   6000.00 |
+-----------+
1 row in set (0.00 sec)

mysql> SELECT DeptID, count(*) AS EMP_COUNT FROM Staff;
ERROR 1140 (42000): In aggregated query without GROUP BY, expression #1 of SELECT list contains nonaggregated column '23mca4.Staff.DeptID'; this is incompatible with sql_mode=only_full_group_by
mysql> SELECT DeptID, count(*) AS EMP_COUNT FROM Staff GROUP BY DeptID;
+--------+-----------+
| DeptID | EMP_COUNT |
+--------+-----------+
|      2 |         3 |
|      1 |         2 |
|      3 |         1 |
|      4 |         2 |
+--------+-----------+
4 rows in set (0.00 sec)

mysql> SELECT Name,MAX(Basic)AS MAXSALARY FROM Staff GROUP BY Name;
+---------+-----------+
| Name    | MAXSALARY |
+---------+-----------+
| Varun   |   6000.00 |
| Ram     |   2000.00 |
| Ruby    |   2000.00 |
| Mary    |   4500.00 |
| Mridula |   6000.00 |
| Menon   |   1500.00 |
| Tim     |   1500.00 |
| Kiran   |   4000.00 |
+---------+-----------+
8 rows in set (0.00 sec)

mysql> SELECT Name, FROM staff WHERE Basic=MAX(Basic)AS MAXSALARY;
ERROR 1064 (42000): You have an error in your SQL syntax; check the manual that corresponds to your MySQL server version for the right syntax to use near 'FROM staff WHERE Basic=MAX(Basic)AS MAXSALARY' at line 1
mysql> SELECT Name, FROM staff WHERE Basic=MAX(Basic);
ERROR 1064 (42000): You have an error in your SQL syntax; check the manual that corresponds to your MySQL server version for the right syntax to use near 'FROM staff WHERE Basic=MAX(Basic)' at line 1
mysql> ==========-=======================-===
[2]+  Stopped                 mysql -u 23mca4 -p
23mca4@rgit:~$ 


